Genre,Poem,Poem Url
Death,"II.All night long we lie Stupidly watching the smoke puff over the sky, Stupidly watching the interminable stars Come out again, peaceful and cold and high, Swim into the smoke again, or melt in a flare of red… All night long, all night long, Hearing the terrible battle of guns, We smoke our pipes, we think we",https://www.poets.org/poetsorg/poem/1915-trenches
Death,"They sing their dearest songs— He, she, all of them—yea, Treble and tenor and bass. And one to play; With the candles mooning each face... Ah, no; the years O! How the sick leaves reel down in throngs!They clear the creeping moss— Elders and juniors-—aye, Making the pathways neat And the garden gay; And they build a shady seat... Ah, no;",https://www.poets.org/poetsorg/poem/during-wind-and-rain
Death,"He saw her from the bottom of the stairs Before she saw him.She was starting down, Looking back over her shoulder at some fear. She took a doubtful step and then undid it To raise herself and look again.He spoke Advancing toward her:'What is it you see From up there",https://www.poets.org/poetsorg/poem/home-burial
Death,"Who goes there? hankering, gross, mystical, nude; How is it I extract strength from the beef I eat?What is a man anyhow? what am I? what are you?All I mark as my own you shall offset it with your own, Else it were time lost listening to me.I do not snivel that",https://www.poets.org/poetsorg/poem/song-myself-20
Death,"Stretch'd and still lies the midnight, Two great hulls motionless on the breast of the darkness, Our vessel riddled and slowly sinking, preparations to pass to the one we have conquer'd, The captain on the quarter-deck coldly giving his orders through a countenance white as a sheet, Near by the corpse of the child",https://www.poets.org/poetsorg/poem/song-myself-36
Death,"Allons! after the great Companions, and to belong to them!They too are on the road—they are the swift and majestic men— they are the greatest women,Enjoyers of calms of seas and storms of seas,Sailors of many a ship, walkers of many a mile of land,Habituès of many distant countries, habituès of",https://www.poets.org/poetsorg/poem/song-open-road-12
Death,"Has any one supposed it lucky to be born? I hasten to inform him or her it is just as lucky to die, and I know it.I pass death with the dying and birth with the new-wash'd babe, and am not contain'd between my hat and boots, And peruse manifold objects, no",https://www.poets.org/poetsorg/poem/song-myself-7
Death,"Out of the rolling ocean, the crowd, came a drop gently to me, Whispering I love you, before long I die, I have travel'd a long way, merely to look on you to touch you, For I could not die till I once look'd on you, For I fear'd I might afterward lose you.Now",https://www.poets.org/poetsorg/poem/out-rolling-ocean-crowd
Death,"O God, my dream! I dreamed that you were dead; Your mother hung above the couch and wept Whereon you lay all white, and garlanded With blooms of waxen whiteness. I had crept Up to your chamber-door, which stood ajar, And in the doorway watched you from afar, Nor dared advance to kiss your lips and",https://www.poets.org/poetsorg/poem/threshold
Death,"Sunset and evening star, And one clear call for me! And may there be no moaning of the bar, When I put out to sea,But such a tide as moving seems asleep, Too full for sound",https://www.poets.org/poetsorg/poem/crossing-bar
Death,"Upon the mountain’s distant head,With trackless snows for ever white, Where all is still, and cold, and dead,Late shines the day’s departing light.But far below those icy rocks,The vales, in summer bloom arrayed, Woods full of birds, and fields of flocks, ",https://www.poets.org/poetsorg/poem/upon-mountains-distant-head
Death,"If I should die,And you should live,And time should gurgle on,And morn should beam,And noon should burn,As it has usual done;If birds should build as early,And bees as bustling go,—One might depart at optionFrom enterprise below!’T is sweet to know that stocks will standWhen we with daisies lie,That commerce will",https://www.poets.org/poetsorg/poem/if-i-should-die-54
Death,"Once upon a midnight dreary, while I pondered, weak and weary, Over many a quaint and curious volume of forgotten lore— While I nodded, nearly napping, suddenly there came a tapping, As of some one gently rapping, rapping at my chamber door— ""'Tis some visitor,"" I muttered, ""tapping at my chamber door— ",https://www.poets.org/poetsorg/poem/raven
Audio,At the mosque’s entrance3:30 a.m. Syrian women beg wearing black gloves. Your father’s grandmother was Syrianbefore the country was ash.Before the government turnedto kill its people.What incites that internal blaze? What says it is me,https://www.poets.org/poetsorg/poem/solemnity
Audio,"{on the occasion of Martin Puryear’s Noblesse O’ (red cedar and aluminum paint) at the Dallas Museum of Art}Perfect for picking up marbles, For finding, lifting, a favoriteBlade of grass, O’ magic elastic straw of the watering hole,Perfected for sucking, water, up, Then miraculously aiming back Around, into the mouth, mod implement",https://www.poets.org/poetsorg/poem/o-noblesse-o
Audio,"Well, I guess no one can have everything. I must learn to celebrate when I fail. Inner growth and fortitude follow the sting, right? Won't I rise with holy wind in my sails? Yet they always seem to get what I want, door after door flung open. Why are the keepers of doors, who haunt the hopeful",https://www.poets.org/poetsorg/poem/lifted
Audio,(for Ntozake Shange)I used to be a roller coaster girl 7 times in a row No vertigo in these skinny legs My lipstick bubblegum pinkAs my,https://www.poets.org/poetsorg/poem/i-used-be-roller-coaster-girl
Death,"""I am come—I am come! once again from the tomb,In return for the ring which you gave;That I am thine, and that thou art mine,This nuptial pledge receive.""He lay like a corse 'neath the Demon's force,",https://www.poets.org/poetsorg/poem/vampire-bride-i-am-come-i-am-come
Death," LINES WRITTEN IN THE VALE OF CHAMOUNIThe everlasting universe of things Flows through the mind, and rolls its rapid waves, Now dark—now glittering—now reflecting gloom— Now lending splendour, where from secret springs The source of human thought its tribute brings Of waters,—with a sound but half its own, Such as a feeble brook",https://www.poets.org/poetsorg/poem/mont-blanc
Death,"I that in heill was and gladness Am trublit now with great sickness And feblit with infirmitie:Timor Mortis conturbat me.Our plesance here is all vain glory, This fals world is but transitory, The flesh is bruckle, the Feynd is slee:Timor Mortis conturbat me. The state of man does",https://www.poets.org/poetsorg/poem/lament-makaris
Death,"Adam lay ibounden,Bounden in a bond; Four thousand winterThoght he not too long; And all was for an appil,An appil that he tok, As clerkes findenWreten in here book. Ne hadde the appil take",https://www.poets.org/poetsorg/poem/adam-lay-ibounden
Death,O Distinct Lady of my unkempt adoration if i have made a fragile certainsong under the window of your soul it is not like any songs (the singers the others they have been faithfulto many things and which die i have been sometimes true to Nothing and which livesthey were fond of the handsome moon never spoke ill,https://www.poets.org/poetsorg/poem/amores-xi
Death,"the glory is fallen out of the sky the last immortal leaf isdead and the gold year a formal spasm in thedust this is the passing of all shining things therefore we also blandlyinto receptive earth,O let us descendtake shimmering wind these fragile splendors from us crumple them hidethem in thy breath drive them in nothingness for we would sleepthis is the passing of all shining things no lingering",https://www.poets.org/poetsorg/poem/amores-viii
Death,"A snake came to my water-trough On a hot, hot day, and I in pyjamas for the heat,To drink there.In the deep, strange-scented shade of the great dark carob treeI came down the steps with my pitcherAnd must wait, must stand and wait, for there he was at the trough before",https://www.poets.org/poetsorg/poem/snake-0
Death,"Always before your voice my soulhalf-beautiful and wholly drollis as some smooth and awkward foal,whereof young moons beginthe newness of his skin, so of my stupid sincere youththe exquisite failure uncouthdiscovers a trembling and smoothUnstrength,against the strongsilences of your song; or as",https://www.poets.org/poetsorg/poem/songs-iii
Audio,"Smelling of sweet resin the Aleppo pines' shadows grow taller by the hour. Two identical twin boys chase each other through the shadows, the one who's ten minutes older yelling, I'm gonna kill you while the younger one laughs, Kill me, kill me if you can! Day by day these teatime mortars keep pecking at the blast",https://www.poets.org/poetsorg/poem/youth
Audio,"We walk through clouds wrapped in ancient symbolsWe descend the hill wearing water Maybe we are deadand don’t know itMaybe we are violet flowers and those we long for love onlyour unmade heartsOn attend, on attendWait for Duras and Eminescuto tell us in French then Romanianlight has wounds slow down— memory is",https://www.poets.org/poetsorg/poem/dor
Audio,"When I rose into the cradle of my mother’s mind, she was but a girl, fighting her sisters over a flimsy doll. It’s easy to forget how noiseless I could be spying from behind my mother’s eyes as her mother, bulging with a baby, a real-life Tiny Tears, eclipsed the doorway with a moon. We all fell silent. My",https://www.poets.org/poetsorg/poem/hunger
Audio,for my grandfatherWe don’t have heirlooms. Haven’t owned things long enough. We’re hoarding us in our stories.,https://www.poets.org/poetsorg/poem/no-kanye-its-not-were-mentally-prison
Audio,i. I’ve pulled from my throat birdsong like tin- sheeted lullaby [its vicious coldits hoax of wings] the rest of us forest folk dark angels chafing rabbits- foot for,https://www.poets.org/poetsorg/poem/color-landscape-tenuous-rope
Audio," My neighbor to the left had a stroke a couple years ago. It didn’t look like he was going to make it, and then he made it. I’m watching him now from my window as",https://www.poets.org/poetsorg/poem/my-life-brutalist-architecture-1
Audio,"When, at the end, the children wantedto add glitter to their valentines, I said no. I said nope, no, no glitter, and then,when they started to fuss, I found myself saying something my brother’s football coachused to bark from the sidelines when one of his players showed",https://www.poets.org/poetsorg/poem/will-you
Audio,Liquid alignment of fabric and outerthigh. Slip. Which mimics the thing it’s,https://www.poets.org/poetsorg/poem/slip
Audio,"Ojhas are [medicine men, “the ones next to God,” religious ministers or priests who deal with the daily struggles of the village people]; this dynamic allows the village ojha to control the circulation of rumors, and he is the village member who has the power to trap daayans (witches). In",https://www.poets.org/poetsorg/poem/ojha-rituals
Audio,"The Junior Minister waved a hand toward the courtyard where, he said, ",https://www.poets.org/poetsorg/poem/unified-berlin
Audio,"When did I know that I’d have to carry it around in order to have it when I need it, say in a pocket,the dark itself not dark enough but needing to be added to, handful by handful if necessary, untilthe way my mother would sit all night in a room without the",https://www.poets.org/poetsorg/poem/night-6
Audio,"I've been fighting a War Within Myself all my life, Tired of the hurt, the pain, the strife. Anger consumes me from day to day, Cellies now walking on eggshells, unsure of what to say. I do pray each night for the peace that I need in my heart, I need it before I tear",https://www.poets.org/poetsorg/poem/war-within-myself
Audio,"The hurt returns as it always intended—it is tender as the inside of my thighs, it is as blue, too. O windless,wingless sky, show me your empire of loneliness, let me spring from the jaws of what tried to kill",https://www.poets.org/poetsorg/poem/gloaming-roiling-night
Audio,I told a million lies now it’s time to tell a single truth Sometimes I cry It’s hard dealing with my pride Not knowing whether to fight or flee Sometimes I cry Hard to maintain this image of a tough guy When deep down inside I am terrified If I ever told you I wasn’t scared I,https://www.poets.org/poetsorg/poem/sometimes-i-cry
Audio,"A metal bunk bed A mattress and hard pillow Two lockers and one desk A toilet and sink A door that is closed Heat out the vent and it’s hot I’m sweating, yet it’s cold A night light on, yet it’s dark A sheet covers me Yet I want more than a sheet The floor is cold Yet I",https://www.poets.org/poetsorg/poem/cell
Audio,the gone did not go so that we’d endure plucking grapes from the potato salad we did not stretch Frankie Beverly’s voice like a tent across this humble meadow of amber folk sipping gold sun through skin rejoicing over their continued breath just for you to invite anyone in able to pause the bloody legacy and distract your,https://www.poets.org/poetsorg/poem/be-considered-inviting-everyone-cookouttm
Audio,"My brother, wanting to off himself, Took rope into a summer park. Rope, plus a knife For cutting it: a serrated hawkbill, Cushioned grip, with two-inch Curved, ignoble blade The manufacturers in their cruelty call A lightweight Meadowlark. Cruel because the meadowlark Is calm. They’re calm This morning. Sure, they shaggle the corn a bit, But",https://www.poets.org/poetsorg/poem/meadowlark
Audio,"And on the first daygod madesomething up.Then everything came along: seconds, sex andbeasts and breaths and rabies;hunger, healing,lust and lust’s rejections;swarming things that swarminside the dirt;girth and grindand grit and shit and all shit’s functions;rings inside the treetrunkand",https://www.poets.org/poetsorg/poem/makebelieve
Audio,"We pay to enter the dirty pen. We buy small bags of feed to feed the well-fed animals. We are guests in their home, our feet on their sawdust floor. We pretend not to notice the stench. Theirs is a predictable life. Better, I guess, than the slaughter, is the many-handed god. Me? I’m going to leave here, eat a",https://www.poets.org/poetsorg/poem/petting-zoo
Audio,"And after the black boy is strangled by police, after the protests where the man, his Rottweiler on an iron leash yells, let's go mash up dis city and another crowd bulks, the parents of the murdered beg us not to become the monsters some think we already are—even when the barista shakes",https://www.poets.org/poetsorg/poem/rashan-charles
Audio,"after a bottle of chianti Don’t mistake me, I’ve pondered this before. But tonight I’m serious. ",https://www.poets.org/poetsorg/poem/helen-considers-leaving-troy
Audio,"The war was all over my hands. I held the war and I watched them die in high-definition. I could watch anyone die, but I looked away. Still, I wore the war on my back. I put it on every morning. I walked the dogs and they too wore the war. The sky overhead was",https://www.poets.org/poetsorg/poem/i-never-figured-how-get-free
Audio,"Guilty Guilty Guilty for actions that took my sympathy Shackles around my wrist shackles at my feet Prom and high school graduation these eyes will never see My heart said, Oh well At least you will no longer have to endure your daily home abuse I grew into a woman unbalanced behind those wire fences Recall",https://www.poets.org/poetsorg/poem/my-eyes-have-seen-what-my-heart-has-felt
Audio,"They ask what I believe in— Sour milk: the curdle & butter of it Baby’s breath ragged with phlegmThe green sheen clinging to her skin like algae The bone & teeth of us mossy and alive with DNABut what’s your religion, they’re after— What gods do you pray to? The frilly curtains of her",https://www.poets.org/poetsorg/poem/answers
Audio,Love me stupid. Love me terrible. And when I am no mountain but rather a monsoon of imperfect thunder love me. When I am blue in my face from swallowing myself yet wearing my best heart even if my best heart is a century of hunger an angry mule breathing hard or perhaps even hopeful. A small sun. Little & bright. ,https://www.poets.org/poetsorg/poem/hon-or-we-have-both-traveled-other-side-some-hill-one-side-which-we-may-wish-we-could
Audio,my roommate one year in college would say of my smallnessthat any man who found me attractive had a trace of the pedophilic & i would shrinknewly girled twenty-one with my,https://www.poets.org/poetsorg/poem/1000
Audio,"I love two dogs, even when they’re killing a baby possum near the columbines, shaking the varmint until the death squeal chokes to a gargle, and both dogs stand before the bloody marsupial nosing it to move, because that’s Nature, right? (And whom did I just ask whether that was right?) (And what’s a moral quandary",https://www.poets.org/poetsorg/poem/when-i-am-hummingbird
Audio,"for TomicaMy love is as ancient as my blood. And of course my blood is still mine because a woman, sweetened black with good song, pulled me from the river like an axe pulled back from the bark. I learned love, first, as scar. And of course my love is",https://www.poets.org/poetsorg/poem/prayer-severing-cycle
Audio,"when I dropped my 12-year-old off at her first homecoming dance, I tried not to look her newly-developed breasts, all surprise and alert in their uncertainty. I tried not to imagine her mashed between a young man's curiousness and the gym's sweaty wall. I tried not picture her grinding off beat/on time to",https://www.poets.org/poetsorg/poem/inevitable
Audio,so many this mornings so many movement so many breezesso many cypress so many doorways demolished so many brushso many vines crawl up the front of that house and so manyspaces so many wide open between one structure and anotherso many ditches so many cars parked,https://www.poets.org/poetsorg/poem/so-many
Audio,"After Ocean Vuong’s “Prayer for the Newly Damned”Dearest Mother, what becomes of the girl no longer a girl?The stretch marks from my once breasts have migrated to their new tectonicflats. But you can always find hints of what used",https://www.poets.org/poetsorg/poem/one-geography-belonging
Audio,"Sometimes it pays to go to Bojangles. To drive out of the parking lot, see the red awning: Fish &Duck Skills. A man walks out and it is broad daylight. Back when I was a new adult in Chattanooga I’d dare myself to go to the Adult Book Shop on Market Street in",https://www.poets.org/poetsorg/poem/fish-duck-skills
Audio,"I'm few deja-vus from repeating my whole life I need to study the shapes of things before death Before declaring myself a better failure: waiting mostly for files to get uploaded or downloaded. My movements are by the book. I will remember history, all of it, before uttering the next sentence And in its",https://www.poets.org/poetsorg/poem/untitled-7
Audio,After the exhibition “La Gravedad de Los Asuntos (Matters of Gravity)” The Mexicans and the Russians were always in on itThis is,https://www.poets.org/poetsorg/poem/only-we-make-beautiful-things-just-destroy-them
Audio,"By Hannah Ensor and Laura WetheringtonIn meditation my thought-labeling has gotten more specific: raging. capital. scheming. What is the nothingness before the storm? I have tried to be tzim tzum. I have tried to forget the word MARTYR. So many parts of my life are like that, like when the thought comes and I keep",https://www.poets.org/poetsorg/poem/feel-piece-4
Audio,"Maybe silence adds to the pain and maybe pain adds to the sea and maybe the sea is only a reflection of a ruin today where the mind is unable to make out how things used to be for us: complete, with deities, a kind oforder. Oh never mind the ATMsscattered throughout the medieval",https://www.poets.org/poetsorg/poem/lindos-greece
Audio,How is it you bring me back to the cliffs   the bright heads of eagles   the vessels of grief in the soil?   I dig for you with a gentle bit of lighter fluid and three miniature rakes   burning only a single speck of dirt to touch,https://www.poets.org/poetsorg/poem/i-hear-dog-who-always-my-death
Audio,"The way I’m strapped into myself I can’t escape. Wake up and be a better person! Clip your toenails, and by sun-rise make sure you’re sitting at the table",https://www.poets.org/poetsorg/poem/republic-1
Audio,"And those other females who managed to slip the collar for a moment or two of life were branded “bad.”–Clarrisa Pinkola Estés, from Women Who Run with the Wolves: Myths and Stories of the Wild Woman ArchetypeThe secret nests in my marrow.At the striptease I appear pirouetteand prey. Later,",https://www.poets.org/poetsorg/poem/little-red-riding-hoodcompanion
Audio,you cannot read what you do not collect the rain came in algidity after suffocating heat still the ravaging of marow is worth it tendons swollen & seasoned with need madness is always a hunger,https://www.poets.org/poetsorg/poem/i-have-new-obsession-bones
Audio,Still turnstiles framed by a window the red alders of Willapa Bay [,https://www.poets.org/poetsorg/poem/hither-come-hither
Audio,"			 For Chinga La MigraIf a woman illegally crossing The U.S.-Mexico border can sing The Border Patrol agent’s favorite Selena song, will he still detain her? What if he does & later writes about Her in the patrol vehicle’s back seat Singing his favorite",https://www.poets.org/poetsorg/poem/popular-culture-cruel-work
Audio,"Christmas Eve, 2016Before everyone died – in my family – first definition I learned was – my mother’s maiden name, ULANDAY – which literally means – of the rain – and biology books remind us – the pouring has a pattern –  has purpose – namesake means release – for",https://www.poets.org/poetsorg/poem/while-looking-photo-albums
Audio,it was summer and time circled itself like a swarm of gnats, 
Audio,"Six months ago, the measuring of whiskey left in the jug, urine on the mattress, couch cushions, the crotch of pants in wear. You watch how breath lifts a chest, how a person breathes— sick hobbies of when we must. You watch how you become illiterate at counting. Six or seven broken breathalyzers; a joke formulates in",https://www.poets.org/poetsorg/poem/exercise-forgiving
Audio,"7. Letters arrived in intervals, as with everything else one might come, one might not regardless of whether there’d been a response. We prepared at all times. Bent over. We dreamed things would be different. Every time the door opened we each smiled in a way to make clear we’d",https://www.poets.org/poetsorg/poem/plan-upon-arrival
Audio,In the mercy of the more hollow sisterA serene fog of moons sprinkled with plum the vexed haint of Quasimoto is patient her tongue leaps from her mouth like a tombstone three times Smooth as ashher favorite word is 'apothecary' the bliss in me like the interior of a melting fear as she moves,https://www.poets.org/poetsorg/poem/sound-has-ears
Audio,for M1.who conceived that ravineorthe contourof those slopesTorbay,https://www.poets.org/poetsorg/poem/hair-0
Audio,"Yoked to what? To whom? Calibration. Checkmate.Thunderous blowhard, tiny tea kettle. Boom.Bastion at the market, flashlight mimicry.Look at my phrase making, batting eyes.Whose hand do you hold? Whose hand do you want?Enough of this, ruiner. What’s the gift of talk,talk, talk. Where’re your minions, battle stations.Take out your troubled photocopies and burnthe Pilgrim’s kiss. There’s only one story. It",https://www.poets.org/poetsorg/poem/publicity
Audio,The larval aura makes summer sense to me who’s alone with my aftermath and the teeth have been torn out of the mask that represents mimicry nobody wants to tell me with summer-breaths where it hurts or who was injured when I broke into a toxic garble with a hissing snake for a heart when I was sweaty and tired I,https://www.poets.org/poetsorg/poem/summer-5
Audio,Why don’t more animals pass through here? Dale asked There were none But sounds shifting in thick oil behind the cement wall that kept precisely those animals out the moon was rising a bruise was rakish on the moon’s right brain A coyote to the southwest on,https://www.poets.org/poetsorg/poem/desert-0
Audio,"The human brain wants to complete—The poem too easy? Bored. The poem too hard? Angry. What’s this one about? Around the block the easy summer weather, the picture-puff clouds adrift in the blue sky that’s no paint-by-numbers. In the corner garden, the cabbage butterfly bothers the big leafy heads, trying to complete its life cycle",https://www.poets.org/poetsorg/poem/cabbage-butterfly
Audio,From the island he saw the castle and from the castle he saw the island. Some people live this way—wife/ mistress/wife/mistress. But this story isn’t the one I’m telling. From the island he saw the castle and that made him distant from power and from the castle he saw the island and that made him distant from imagining what,https://www.poets.org/poetsorg/poem/peacock-island
Audio,"There is one atop each of the Girls’ heads. Clearly they have been playing this game for a while. There is only one girl whose turkey is still full of air, and that girl is Girl D. The game is called Duck, Duck, Turkey. They go through the motions of",https://www.poets.org/poetsorg/poem/deflated-rubber-turkey
Audio,"it ends my sleep to want my story about my skin melting in the sun that day of summer and a doctor who tells me i am dying, that thing i hide under my nails like dirt scratched from summer skin. so i pick up a pencil and begin to erase myself. erasure is",https://www.poets.org/poetsorg/poem/portraitures-and-erasures
