Genre,Poem,Poem Url
Nature,"you can make the maples blazejust by stopping to look,you can set your clock to the barksof geese. Somewhere the grandfatherswho own this town lean down to ironcrisp blue shirts, their faces bathingin steam, and blackbirdsclamor in packs,make plans behind corn.",https://www.poets.org/poetsorg/poem/kid-october
Nature,1 Muddled stillnessAll summer SunPunched the yellow jacket nest Cavernous paper Valved like a parched heart Over and over I let it Beat outside My body No dark to cradle The living part2 The glare sears seeing ,https://www.poets.org/poetsorg/poem/first-forty-days
Nature,"I have been a spendthrift Dropping from lazy fingers Quiet coloured hours, Fluttering away from me Like oak and beech leaves in October.I have lived keenly and wastefully, Like a bush or a sun insect— Lived sensually and thoughtfully, Loving the flesh and the beauty of this world— Green ivy about ruined towers, The out-pouring of the grey sea, And",https://www.poets.org/poetsorg/poem/bondage
Nature,"And on the first daygod madesomething up.Then everything came along: seconds, sex andbeasts and breaths and rabies;hunger, healing,lust and lust’s rejections;swarming things that swarminside the dirt;girth and grindand grit and shit and all shit’s functions;rings inside the treetrunkand",https://www.poets.org/poetsorg/poem/makebelieve
Nature,"When pulled, the spider web took another form.The bull’s-eye relaxed, the bull unseen but felt,skull on muscle paused on the forest floor.The girl said oh, as she had heard her mothersay before. The spider had already hiddenin the labyrinth of a tree. The city ranon coal and gasoline as it",https://www.poets.org/poetsorg/poem/labyrinth-tree
Nature,Love me stupid. Love me terrible. And when I am no mountain but rather a monsoon of imperfect thunder love me. When I am blue in my face from swallowing myself yet wearing my best heart even if my best heart is a century of hunger an angry mule breathing hard or perhaps even hopeful. A small sun. Little & bright. ,https://www.poets.org/poetsorg/poem/hon-or-we-have-both-traveled-other-side-some-hill-one-side-which-we-may-wish-we-could
Nature,"To pick a tulip from the garden, the red one. To put it on the desk In the small blue vase, here. No, Here.To incline toward it then, as if the flower could teach me something Of its art.Of my own art. When did we forget",https://www.poets.org/poetsorg/poem/what-april-proscribes
Nature,Whose woods these are I think I know. His house is in the village though, He will not see me stopping here To watch his woods fill up with snow.My little horse must think it queer To stop without a farmhouse near Between the woods and frozen lake The darkest evening of the year.He gives his
Nature,"/1/What forest is there to run to, other than the one within another’s heart?What appears to be deeply rootedis half dead drowning and sucking at the sun./2/I hate to say this",https://www.poets.org/poetsorg/poem/come-pioneer
Nature,"“river with a valley so shallow it is measured in inches” says McKibben and no longer Ever but shrinking, this marsh-wealth in a buzz of conversing, wing flaps and wind, ringed by housing,",https://www.poets.org/poetsorg/poem/everglades-0
Nature,"Across the dunes, in the waning light, The rising moon pours her amber rays, Through the slumbrous air of the dim, brown night The pungent smell of the seaweed strays—From vast and trackless spacesWhere wind and water meet,",https://www.poets.org/poetsorg/poem/drifting-flowers-sea
Nature,"When I go up through the mowing field,The headless aftermath, Smooth-laid like thatch with the heavy dew,Half closes the garden path.And when I come to the garden ground,The whir of sober birds Up from the tangle of",https://www.poets.org/poetsorg/poem/late-walk
Nature,"When I was young, we dwelt in a valeBy a misty fen that rang all night, And thus it was the maidens pale I knew so well, whose garments trailAcross the reeds to a window light.The fen had every kind of bloom, ",https://www.poets.org/poetsorg/poem/vale
Nature,"Except within poetic paleI have not found a nightingale, Nor hearkened in a dusky valeTo song and silence blending; No stock-dove have I ever heard, Nor listened to a cuckoo-bird,Nor seen a lark ascending. But I have felt a pulse-beat startBecause a",https://www.poets.org/poetsorg/poem/robin
Nature,"How fresh, O Lord, how sweet and clean Are Thy returns! ev’n as the flow’rs in Spring, 	To which, besides their own demean The late-past frosts tributes of pleasure bring; 	 Grief",https://www.poets.org/poetsorg/poem/flower
Nature,"Oh, give us pleasure in the flowers to-day; And give us not to think so far away As the uncertain harvest; keep us here All simply in the springing of the year.Oh, give us pleasure in the orchard white, Like nothing else by day, like ghosts by night; And make us happy in the happy",https://www.poets.org/poetsorg/poem/prayer-spring
Nature,"A saturated meadow,Sun-shaped and jewel-small, A circle scarcely widerThan the trees around were tall; Where winds were quite excluded,And the air was stifling sweet With the breath of many flowers,— A temple of the heat.These",https://www.poets.org/poetsorg/poem/rose-pogonias
Nature,"What things for dream there are when spectre-like, Moving among tall haycocks lightly piled, I enter alone upon the stubble field, From which the laborers’ voices late have died, And in the antiphony of afterglow And rising full moon, sit me down Upon the full moon’s side of the first haycock And lose myself amid so many",https://www.poets.org/poetsorg/poem/waiting-afield-dusk
Nature,They heard the South wind sighing A murmur of the rain, And they knew that Earth was longing To see them all again. While the snow-drops still were sleeping Beneath the silent sod
Nature," Dim vales—and shadowy floods—And cloudy-looking woods,Whose forms we can’t discoverFor the tears that drip all overHuge moons there wax and wane— ",https://www.poets.org/poetsorg/poem/fairy-land
Nature," ‘Tis said that whenThe hands of menTamed this primeval wood,And hoary trees with groans of woe,Like warriors by an unknown foe, ",https://www.poets.org/poetsorg/poem/forest-reverie
Nature," Fair river! in thy bright, clear flowOf crystal, wandering water,Thou art an emblem of the glowOf beauty—the unhidden heart—",https://www.poets.org/poetsorg/poem/river-0
Nature, In spring of youth it was my lotTo haunt of the wide earth a spotThe which I could not love the less—So lovely was the loneliness ,https://www.poets.org/poetsorg/poem/lake
Nature," At midnight in the month of June,I stand beneath the mystic moon.An opiate vapour, dewy, dim,Exhales from out her golden rim,And, softly dripping, drop by",https://www.poets.org/poetsorg/poem/sleeper
Nature,"Lo! in the painted oriel of the West,Whose panes the sunken sun incarnadines,Like a fair lady at her casement, shinesThe evening star, the star of love and rest!And then anon she doth herself divestOf all her radiant garments, and reclinesBehind the sombre screen of yonder pines,With slumber and soft dreams",https://www.poets.org/poetsorg/poem/evening-star
Nature," Kind solace in a dying hour!Such, father, is not (now) my theme—I will not madly deem that powerOf",https://www.poets.org/poetsorg/poem/tamerlane
Nature," In these rapid, restless shadows,Once I walked at eventide,When a gentle, silent maiden,Walked in beauty at my side ",https://www.poets.org/poetsorg/poem/village-street
Nature,"The three stood listening to a fresh accessOf wind that caught against the house a moment,Gulped snow, and then blew free again—the ColesDressed, but dishevelled from some hours of sleep,Meserve belittled in the great skin coat he wore.Meserve was first to speak. He pointed backwardOver his shoulder with his pipe-stem,",https://www.poets.org/poetsorg/poem/snow-2
Nature,"What I meant is that when the child shook the branch,the beetles, quiet, somnolent, darkly, fell and again felllike plums. Once woken, they bzzzed towardsthe street lamps, loving each light well, thwackingagainst them until they landed face down or faceup, trying to find their feet, reminding me of Eve’s faceas",https://www.poets.org/poetsorg/poem/wonder-days
Nature,"My words are dust. I who would build a star, I who would touch the heel of the white sun; Staggering up the inaccessible sky, I look upon the dust.The stainless clouds go mounting In shining spires; And a little heap of dust Are my desires.Yet, dwelling long upon these peaks Unchained upon the flickering western sky, I have",https://www.poets.org/poetsorg/poem/dust-0
Nature,"Shiitake, velvet foot, hen of the woods, woodear, cloud ear, slippery jack, brown wreathsof Polish borowik dried and hangingin the stalls of a Krakow market—all thesewere years away from the room where I layonce, studying the contours of your sexas if it were some subterranean speciesI’d",https://www.poets.org/poetsorg/poem/introduction-mycology
Nature,"A humble flower long time I pined Upon the solitary plain, And trembled at the angry wind, And shrunk before the bitter rain. And oh! 'twas in a blessed hour A passing wanderer chanced to see,",https://www.poets.org/poetsorg/poem/song-violet-0
Nature,"Yonder to the kiosk, beside the creek, Paddle the swift caque. Thou brawny oarsman with the sunburnt cheek, Quick! for it soothes my heart to hear the Bulbul speak.Ferry me quickly to the Asian shores, Swift bending to your oars. Beneath",https://www.poets.org/poetsorg/poem/caique
Nature,"High up in the apple tree climbing I go, With the sky above me, the earth below. Each branch is the step",https://www.poets.org/poetsorg/poem/climbing
Nature,"On deck, beneath the awning, I dozing lay and yawning; It was the gray of dawning, Ere yet the sun arose; And above the funnel's roaring, And the fitful wind's deploring, I heard the cabin snoring With",https://www.poets.org/poetsorg/poem/white-squall-0
Nature,"The rose upon my balcony the morning air perfuming, Was leafless all the winter time and pining for the spring; You ask me why her breath is sweet, and why her cheek is blooming, It is because the sun is out and birds begin to",https://www.poets.org/poetsorg/poem/rose-upon-my-balcony-0
Nature,"I know a country laced with roads,They join the hills and they span the brooks, They weave like a shuttle",https://www.poets.org/poetsorg/poem/roads
Nature,"I own a solace shut within my heart,A garden full of many a quaint delightAnd warm with drowsy,",https://www.poets.org/poetsorg/poem/behind-wall
Nature,"Softly the water ripplesAgainst the canoe's curving side, Softly the birch trees rustle",https://www.poets.org/poetsorg/poem/loon-point
Nature,"Glinting golden through the trees,Apples of Hesperides! Through the moon-pierced warp of night",https://www.poets.org/poetsorg/poem/apples-hesperides
Nature,"She’ll hold her hand out a window on a June day, snatch a chubby fistful of air, clutch it all night beneath her sheets. Out of a dream of flight she’ll emerge, vast as a yard of clover, and fall like a comforter over the neighborhood. Then she’ll shimmerlike a maple in the wind.",https://www.poets.org/poetsorg/poem/ellas-plan
Nature,"How still it is! Sunshine itself here fallsIn quiet shafts of light through the high trees Which, arching, make a",https://www.poets.org/poetsorg/poem/teatro-bambino-dublin-n-h
Nature,"The starlings choose one piece of sky above the riverand pour themselves in. Like a thousand arrows pointing in unison one way, then another. That bit of blue",https://www.poets.org/poetsorg/poem/starlings-0
Nature,"where the sea circles around the island in a star pattern – where in the center of grieving we are disoriented, skinless – where I wade into the field . . . the scent of sun on wheat – where the horses bow in & out, kick up a hoof,",https://www.poets.org/poetsorg/poem/entry-not-island
Nature,"At first a mere thread of a footpath half blotted out by the grasses Sweeping triumphant across it, it wound between hedges of roses",https://www.poets.org/poetsorg/poem/way
Nature,"April had covered the hillsWith flickering yellows and reds, The sparkle and coolness of snow",https://www.poets.org/poetsorg/poem/azure-and-gold
Nature,"High up above the open, welcoming door It hangs, a piece of wood with colours dim. Once, long ago, it was a",https://www.poets.org/poetsorg/poem/japanese-wood-carving
Nature,Goaded and harassed in the factoryThat tears our life up into bits of daysTicked off upon a clock,https://www.poets.org/poetsorg/poem/matrix
Nature,"This little bowl is like a mossy pool In a Spring wood, where dogtooth violets grow Nodding in chequered sunshine of the",https://www.poets.org/poetsorg/poem/green-bowl
Nature,"A Tuesday, day of Tiw,god of war, dawns in darkness.The short holiday day of talking by the fire,floating on snowshoes amongancient self-pollarded maples,visiting, being visited, givinga rain gauge, receiving red socks,watching snow buntings nearly overtheir heads in snow stab at spirtled bitsof sunflower seeds the chickadeeshold with their feet to",https://www.poets.org/poetsorg/poem/26th-december
Nature,"What still grows in winter? Fingernails of witches and femmes, green moss on river rocks, lit with secrets... I let myself go near the river but not the railroad: this is my bargain. Water boils in a kettle in the woods and I can hear the train grow louder but I also can’t, you know? Then I’m shaving in",https://www.poets.org/poetsorg/poem/evergreen-0
Nature,dew grass a fire shine mountain a lung pine cone the bone tsunami rock hawk jaw gravity a fall all consuming a song chirp for sunlight spine daggers cracking the sky an ocean paused in its crashing creature shake trip whistle rustle nut squirrel swish stump thunder or thump thump a swallowing you beautiful urchin you rot mound of moss.,https://www.poets.org/poetsorg/poem/i-dont-know-what-youre-called-ill-call-you-your-sounds
Nature,This painting of a barn and barnyard near sundown May be enough to suggest we don’t have to turn From the visible world to the invisible In order to grasp the truth of things. We don’t always have to distrust appearances. Not if we’re patient. Not if we’re willing To wait for the sun to reach,https://www.poets.org/poetsorg/poem/landscape
Nature,"As from dark orchard leaves, from quiet scripts where each shape sends its tendril reaching— circle and line, the swaddled bud, the petiolesprung, an envelope tendered. 					 By a window, the infantturns, rooting toward the breast,",https://www.poets.org/poetsorg/poem/poem-holderlin
Nature,"—for a sixty-seven-pound nugget of Lake Superior copperfound in an Iowa cornfield Before the earliest flute was carved from a vulture’s wing, before we—what few we were— bowed to the moon, the balmy, secular night, you",https://www.poets.org/poetsorg/poem/foundling
Nature,"New fronds unfurl from the jointsof older ones, like fists slow to open in forgiveness but will inevitably inforgetfulness—that kind of newness green as the green of new ferns snaking fastup the old hosts’ throats turning brownbeneath the ever-creep without a sound (to us— all we hear’s waves).",https://www.poets.org/poetsorg/poem/cliffs-above-oswald
Nature,"Ho, wind of March, speed over sea,     From mountains where the snows lie deep     The cruel glaciers threatening creep,And witness this, my jubilee!Roar from the surf of boreal isles,     Roar from the hidden, jagged steeps,     Where the destroyer never sleeps;Ring through the iceberg’s Gothic piles!Voyage through space with your wild",https://www.poets.org/poetsorg/poem/march
Nature,"The fern gathers where the water seldom goes unless the storms swell this world of wise choices, the loud trickle of clear tongues of the stream licking the edges of rock, while up ahead a curve hides tomorrow from our crystal ball, the thing we are afraid to admit we have, the guarantee we hide from",https://www.poets.org/poetsorg/poem/silver-thread
Nature,"The rising sun had crowned the hills,      And added beauty to the plain;O grand and wondrous spectacle!     That only nature could explain.I stood within a leafy grove,     And gazed around in blissful awe;The sky appeared one mass of blue,     That seemed to spread from sea to shore.Far as the human",https://www.poets.org/poetsorg/poem/morning-shinnecock
Nature,"Memory—died August 3, 2015.  Thedeath was not sudden but slowly over adecade.  I wonder if, when people die,they  hear  a  bell.   Or  if  they  tastesomething sweet, or if they feel a knifecutting them in half, dragging throughthe flesh like sheet cake.  The caretakerwho witnessed my mother’s death quit. She holds the",https://www.poets.org/poetsorg/poem/obit-memory
Nature,"     Behold the dread Mt. Shasta, where it standsImperial midst the lesser heights, and, likeSome mighty unimpassioned mind, companionlessAnd cold. The storms of Heaven may beat in wrathAgainst it, but it stands in unpollutedGrandeur still; and from the rolling mists upheavesIts tower of pride e’en purer than before.The wintry showers",https://www.poets.org/poetsorg/poem/mount-shasta
Nature,"Much have I spoken of the faded leaf;	 Long have I listened to the wailing wind,	 And watched it ploughing through the heavy clouds,	 For autumn charms my melancholy mind.	 When autumn comes, the poets sing a dirge: The year must perish;",https://www.poets.org/poetsorg/poem/november-1
Nature,"No melancholy days are these!     Not where the maple changing stands,Not in the shade of fluttering oaks,            Nor in the bandsOf twisting vines and sturdy shrubs,     Scarlet and yellow, green and brown,Falling, or swinging on their stalks,            Is Sorrow’s crown.The sparkling fields of dewy grass,     Woodpaths and roadsides decked with",https://www.poets.org/poetsorg/poem/autumn-7
Nature,"I feel the breath of the summer night,            Aromatic fire:The trees, the vines, the flowers are astir            With tender desire.The white moths flutter about the lamp,            Enamoured with light;And a thousand creates softly sing            A song to the night!But I am alone, and how can I sing            Praises to thee?Come,",https://www.poets.org/poetsorg/poem/summer-night
Nature,"Welcome, all hail to thee!     Welcome, young Spring!Thy sun-ray is bright     On the butterfly’s wing.Beauty shines forth     In the blossom-robed trees;Perfume floats by     On the soft southern breeze.Music, sweet music,     Sounds over the earth;One glad choral song     Greets the primrose’s birth;The lark soars above,     With its shrill matin strain;The shepherd",https://www.poets.org/poetsorg/poem/spring-2
Nature,"Bring forth the harp, and let us sweep its fullest, loudest string.The bee below, the bird above, are teaching us to singA song for merry harvest; and the one who will not bearHis grateful part partakes a boon he ill deserves to share.The grasshopper is pouring forth his quick and",https://www.poets.org/poetsorg/poem/song-merry-harvest
Nature,"The holly! the holly! oh, twine it with bay—Come give the holly a song; For it helps to drive stern winter away,With his garment so sombre and long. It peeps through the trees with its berries of red,And its leaves of burnish’d green, When",https://www.poets.org/poetsorg/poem/christmas-holly
Nature,"Apii dibikong gaashkendamyaan miinawaa goshkoziyaanWhen in the night I am weary and awake wonderingendigwenh waa ezhichigewag bagoji Anishinaabensag odenang,what the wild young Anishinaabeg of the cities will do,mitigwaakiing izhaayaan miinawaa anweshinyaan.into the woods I go and rest.Nimawadishaag zhingwaakwag miinawaa okikaandagoogI visit with the white pines and the jack pines.Nibizindaawaag zhashagiwag",https://www.poets.org/poetsorg/poem/gidiskinaadaa-mitigwaakiingwoodland-liberty
Nature,"Above the east horizon,The great red flower of the dawnOpens slowly, petal by petal;The trees emerge from darknessWith ghostly silver leaves,Dew powdered.Now consciousness emergesReluctantly out of tides of sleep;Finding with cold surpriseNo strange new thing to match its dreams,But merely the familiar shapesOf bedpost, window-pane, and wall.",https://www.poets.org/poetsorg/poem/dawn-2
Nature,"’Tis the witching time of night,Orbed is the moon and bright,And the Stars they glisten, glisten,Seeming with bright eyes to listen.For what listen they?For a song and for a charm,See they glisten in alarm,And the Moon is waxing warmTo hear what I shall say.Moon! keep wide thy golden ears—Hearken, Stars!",https://www.poets.org/poetsorg/poem/prophecy-george-keats-america
Nature,"This morning a hawk plunges straight for the squirrel at my feeder and leaves only its signature: blood on the snow.All morning it circled the yard, then dove, stunning itself on the glass sky of my window,and in minutes returned, braving the thin, perilous channel between hedgerow and house. I was watching its path as it fell, its persistence,and",https://www.poets.org/poetsorg/poem/backyard
Nature," ’T is you that are the music, not your song.  The song is but a door which, opening wide,  Lets forth the pent-up melody inside,Your spirit’s harmony, which clear and strongSing but of you. Throughout your whole life long  Your songs, your thoughts, your doings, each divide  This perfect beauty;",https://www.poets.org/poetsorg/poem/listening-0
Nature," Since the phlox are dying and the daisies with their bright bodies have shattered in the wind,I go out among these last dancers, cutting to the ground the withered asters, the spent stalks of the lilies, the black rose,and see them as they were in spring, the time of eagerness and blossoms, knowing how they will",https://www.poets.org/poetsorg/poem/gardener
Nature,"These wet rocks where the tide has been,   Barnacled white and weeded brownAnd slimed beneath to a beautiful green,   These wet rocks where the tide went downWill show again when the tide is high   Faint and perilous, far from shore,No place to dream, but a place to die,—   The bottom",https://www.poets.org/poetsorg/poem/low-tide
Nature,"When the bare feet of the baby beat across the grassThe little white feet nod like white flowers in the wind,They poise and run like ripples lapping across the water;And the sight of their white play among the grassIs like a little robin’s song, winsome,Or as two white butterflies settle",https://www.poets.org/poetsorg/poem/baby-running-barefoot
Nature," “God is an infinite sphere, the center of which is everywhere, the circumference nowhere.” ",https://www.poets.org/poetsorg/poem/narration-transubstantiation
Nature,"the room where I want to rest, I find my hands and am able again to see you— clear eyed where we left one another—last year in the passenger’s seat, having woken after Colorado, which was beautifuland which I did not wake you for,wanting all the aspens, all the golden, quaking aspens,",https://www.poets.org/poetsorg/poem/cleaning
Nature,"The deer is still alive in the roadside grass. In an hour, we'll cut her open,her left hip broken, the bonein her dark body; now the white Camaroshocked in the night and the boywet-faced in the back seat,his parents at a lossby the hood, too youngto",https://www.poets.org/poetsorg/poem/venison
Nature,"“It is your very self” I tell him. He has never seen me.His quick coin of breath disappears on the glass as it forms: airthat feeds his bones their portionwillingly as it feeds mine.He spends his here,besieged by the dull birds who gather",https://www.poets.org/poetsorg/poem/cardinal-attacking-his-reflection-window
Nature,"Huge vapours brood above the clifted shore,Night o’er the ocean settles, dark and mute,Save where is heard the repercussive roarOf drowsy billows, on the rugged footOf rocks remote; or still more distant toneOf seamen, in the anchored bark, that tellThe watch reliev’d; or one deep voice aloneSinging the hour, and",https://www.poets.org/poetsorg/poem/huge-vapours-brood-above-clifted-shore
Nature,"I.It could be snow, the way it floats, or ash from ancient volcanoes awake and exploding. But insteadit’s seeds wrapped in something like down, released by the thousands from cottonwood trees. If they land near water they growbut mostly they don’t.The sun starts to set and the air turns the color of",https://www.poets.org/poetsorg/poem/albuquerque-1
Nature,"I will get me to the woodWhere the gods walk garlanded in wisteria,By the silver-blue flood move others with ivory cars.There come forth many maidens                to gather grapes for the leopards, my friend.For there are leopards drawing the cars.",https://www.poets.org/poetsorg/poem/after-chu-yuan
Nature,"By day she woos me, soft, exceeding fair:   But all night as the moon so changeth she;   Loathsome and foul with hideous leprosyAnd subtle serpents gliding in her hair.By day she wooes me to the outer air,   Ripe fruits, sweet flowers, and full satiety:   But through the night, a beast",https://www.poets.org/poetsorg/poem/world-0
Nature,I wake tored sand Isleep herecoral brickhooghaan Iwalk thinrabbit brushtrails side-step earlyautumntarantulas pick desertwhite flowerson full days Iinhale fe-male rainI stop wheelsslow sheepbounce dropsheep shitacross highwayspotholedme I grassnothinghere I meta-grass I sleep-walk grassesopen eyes toblue corn skyto cook upstews chunkshalf-chewed thruI am thissalivatingmouth withouthands with-out arms bent downshamelessface to plate tosome origin(al)hunger awarethat,https://www.poets.org/poetsorg/poem/irony
